{
  "schema_version": "1.0.0",
  "catalog_version": "1.0.0",
  "blocks": [
    { "block_id": "auth.login", "surface": "client", "readiness": "ready" },
    { "block_id": "identity.user-table", "surface": "admin", "readiness": "ready" }
  ],
  "catalog_sha256": "sha256:aaaaaaaaaaaaaaaaaaaaaaaaaaaaaaaaaaaaaaaaaaaaaaaaaaaaaaaaaaaaaaaa"
}
