{
  "schema_version": "1.0.0",
  "catalog_version": "1.3.0",
  "blocks": [
    { "block_id": "account.center", "surface": "client", "readiness": "not_ready" },
    { "block_id": "account.profile", "surface": "client", "readiness": "not_ready" },
    { "block_id": "account.security", "surface": "client", "readiness": "not_ready" },
    { "block_id": "ai.model-route-table", "surface": "admin", "readiness": "not_ready" },
    { "block_id": "assembly.blueprint-wizard", "surface": "admin", "readiness": "ready" },
    { "block_id": "assembly.plan-review", "surface": "admin", "readiness": "ready" },
    { "block_id": "assembly.run-status", "surface": "admin", "readiness": "ready" },
    { "block_id": "assembly.upgrade-plan", "surface": "admin", "readiness": "ready" },
    { "block_id": "audit.event-table", "surface": "admin", "readiness": "not_ready" },
    { "block_id": "auth.login", "surface": "client", "readiness": "not_ready" },
    { "block_id": "auth.recovery", "surface": "client", "readiness": "not_ready" },
    { "block_id": "auth.register", "surface": "client", "readiness": "not_ready" },
    { "block_id": "auth.second-factor", "surface": "client", "readiness": "not_ready" },
    { "block_id": "checkout.summary", "surface": "client", "readiness": "not_ready" },
    { "block_id": "developer-key.table", "surface": "admin", "readiness": "not_ready" },
    { "block_id": "developer.api-keys", "surface": "client", "readiness": "not_ready" },
    { "block_id": "developer.key-secret", "surface": "client", "readiness": "not_ready" },
    { "block_id": "developer.quickstart", "surface": "client", "readiness": "not_ready" },
    { "block_id": "device.list", "surface": "client", "readiness": "not_ready" },
    { "block_id": "device.revoke-confirm", "surface": "client", "readiness": "not_ready" },
    { "block_id": "entitlement.grant-panel", "surface": "admin", "readiness": "not_ready" },
    { "block_id": "entitlement.history", "surface": "admin", "readiness": "not_ready" },
    { "block_id": "entitlement.redeem", "surface": "client", "readiness": "not_ready" },
    { "block_id": "entitlement.summary", "surface": "client", "readiness": "not_ready" },
    { "block_id": "entitlement.table", "surface": "admin", "readiness": "not_ready" },
    { "block_id": "identity.admin-login", "surface": "admin", "readiness": "not_ready" },
    { "block_id": "identity.admin-session-menu", "surface": "admin", "readiness": "not_ready" },
    { "block_id": "identity.user-detail", "surface": "admin", "readiness": "not_ready" },
    { "block_id": "identity.user-table", "surface": "admin", "readiness": "not_ready" },
    { "block_id": "membership.feature-compare", "surface": "client", "readiness": "not_ready" },
    { "block_id": "membership.plan-grid", "surface": "client", "readiness": "not_ready" },
    { "block_id": "notification.inbox", "surface": "client", "readiness": "not_ready" },
    { "block_id": "notification.preferences", "surface": "client", "readiness": "not_ready" },
    { "block_id": "order.detail", "surface": "client", "readiness": "not_ready" },
    { "block_id": "order.list", "surface": "client", "readiness": "not_ready" },
    { "block_id": "payment.cashier", "surface": "client", "readiness": "not_ready" },
    { "block_id": "payment.status", "surface": "client", "readiness": "not_ready" },
    { "block_id": "product.capability-menu", "surface": "admin", "readiness": "ready" },
    { "block_id": "product.capability-settings", "surface": "admin", "readiness": "not_ready" },
    { "block_id": "product.editor", "surface": "admin", "readiness": "not_ready" },
    { "block_id": "product.integration-settings", "surface": "admin", "readiness": "not_ready" },
    { "block_id": "product.overview", "surface": "admin", "readiness": "ready" },
    { "block_id": "product.switcher", "surface": "admin", "readiness": "ready" },
    { "block_id": "product.table", "surface": "admin", "readiness": "ready" },
    { "block_id": "storage.user-files", "surface": "client", "readiness": "not_ready" },
    { "block_id": "support.entry", "surface": "client", "readiness": "not_ready" },
    { "block_id": "tenant.admin-binding", "surface": "admin", "readiness": "not_ready" },
    { "block_id": "tenant.editor", "surface": "admin", "readiness": "not_ready" },
    { "block_id": "tenant.table", "surface": "admin", "readiness": "not_ready" },
    { "block_id": "usage.ledger", "surface": "client", "readiness": "not_ready" },
    { "block_id": "usage.ledger-table", "surface": "admin", "readiness": "not_ready" },
    { "block_id": "usage.overview", "surface": "client", "readiness": "not_ready" },
    { "block_id": "usage.price-editor", "surface": "admin", "readiness": "not_ready" },
    { "block_id": "usage.record-detail", "surface": "client", "readiness": "not_ready" }
  ],
  "catalog_sha256": "sha256:8c04a77144aeb4657c509faa36b0f754f0f6c60f04ce7f385de35ef832ae1e9e"
}
